{
  "map": {
    "actor": "Clinic operator (synthetic)",
    "journey": "Recall one consenting test participant",
    "activities": [
      {
        "id": "find",
        "label": "Find eligible test record",
        "tasks": [
          {
            "id": "select",
            "label": "Select synthetic record",
            "status": "existing"
          }
        ]
      },
      {
        "id": "send",
        "label": "Offer one slot",
        "tasks": [
          {
            "id": "notify",
            "label": "Record simulated send",
            "status": "missing"
          }
        ]
      },
      {
        "id": "confirm",
        "label": "Confirm result",
        "tasks": [
          {
            "id": "display",
            "label": "Show confirmation",
            "status": "missing"
          }
        ]
      }
    ]
  },
  "holes": [
    "No real SMS integration accepted"
  ],
  "confidence": "C",
  "evidence": [],
  "assumptions": [
    "Synthetic exercise only; no patient data or live message"
  ]
}
